{
  "schema_version": "0.2.0",
  "graph_id": "g:pipeline:async",
  "model_sha256": "0000000000000000000000000000000000000000000000000000000000000000",
  "domains": [
    {
      "id": "d:reset",
      "name": "transport reset",
      "kind": "reset"
    },
    {
      "id": "d:async",
      "name": "async neighbors",
      "kind": "async"
    }
  ],
  "nodes": [
    {
      "id": "n:source",
      "path": "pipeline.source",
      "kind": "environment",
      "domains": [
        "d:async",
        "d:reset"
      ],
      "ports": [
        {
          "id": "out",
          "direction": "output"
        }
      ],
      "wait_vocabulary": null
    },
    {
      "id": "n:s1",
      "path": "pipeline.s1",
      "kind": "component",
      "domains": [
        "d:async",
        "d:reset"
      ],
      "ports": [
        {
          "id": "in",
          "direction": "input"
        },
        {
          "id": "out",
          "direction": "output"
        }
      ],
      "wait_vocabulary": null
    },
    {
      "id": "n:s2",
      "path": "pipeline.s2",
      "kind": "component",
      "domains": [
        "d:async",
        "d:reset"
      ],
      "ports": [
        {
          "id": "in",
          "direction": "input"
        },
        {
          "id": "out",
          "direction": "output"
        }
      ],
      "wait_vocabulary": "v:synthetic-service"
    },
    {
      "id": "n:s3",
      "path": "pipeline.s3",
      "kind": "component",
      "domains": [
        "d:async",
        "d:reset"
      ],
      "ports": [
        {
          "id": "in",
          "direction": "input"
        },
        {
          "id": "out",
          "direction": "output"
        }
      ],
      "wait_vocabulary": null
    },
    {
      "id": "n:sink",
      "path": "pipeline.sink",
      "kind": "environment",
      "domains": [
        "d:async",
        "d:reset"
      ],
      "ports": [
        {
          "id": "in",
          "direction": "input"
        }
      ],
      "wait_vocabulary": null
    }
  ],
  "channels": [
    {
      "id": "c:0",
      "source": {
        "node": "n:source",
        "port": "out"
      },
      "sink": {
        "node": "n:s1",
        "port": "in"
      },
      "protocol": "bd.four-phase.held-return@1",
      "reset_domain": "d:reset",
      "capacity_tokens": null,
      "visibility": "complete",
      "payload": {
        "encoding": "bits",
        "width_bits": 8
      },
      "sampling_policy": null
    },
    {
      "id": "c:1",
      "source": {
        "node": "n:s1",
        "port": "out"
      },
      "sink": {
        "node": "n:s2",
        "port": "in"
      },
      "protocol": "bd.four-phase.held-return@1",
      "reset_domain": "d:reset",
      "capacity_tokens": null,
      "visibility": "complete",
      "payload": {
        "encoding": "bits",
        "width_bits": 8
      },
      "sampling_policy": null
    },
    {
      "id": "c:2",
      "source": {
        "node": "n:s2",
        "port": "out"
      },
      "sink": {
        "node": "n:s3",
        "port": "in"
      },
      "protocol": "bd.four-phase.held-return@1",
      "reset_domain": "d:reset",
      "capacity_tokens": null,
      "visibility": "complete",
      "payload": {
        "encoding": "bits",
        "width_bits": 8
      },
      "sampling_policy": null
    },
    {
      "id": "c:3",
      "source": {
        "node": "n:s3",
        "port": "out"
      },
      "sink": {
        "node": "n:sink",
        "port": "in"
      },
      "protocol": "bd.four-phase.held-return@1",
      "reset_domain": "d:reset",
      "capacity_tokens": null,
      "visibility": "complete",
      "payload": {
        "encoding": "bits",
        "width_bits": 8
      },
      "sampling_policy": null
    }
  ],
  "boundaries": [],
  "wait_vocabularies": [
    {
      "id": "v:synthetic-service",
      "contract": "fixture.synthetic-service@1",
      "reasons": [
        "service-deferred"
      ]
    }
  ],
  "queues": [],
  "extensions": {
    "example/provenance": "Hand-authored abstract pipeline. Contract/reason identifiers are synthetic, not chisel-async probe names. Zero model hash is a placeholder."
  }
}
